{
  "decided_at": "2026-10-22T08:00:00Z",
  "decision": "HUMAN_APPROVAL_REQUIRED",
  "gates": [
    {
      "id": "review-approved",
      "status": "pass"
    },
    {
      "id": "ci-required-checks",
      "status": "pass"
    },
    {
      "id": "branch-current",
      "status": "pass"
    },
    {
      "id": "quality-gate",
      "status": "pass"
    }
  ],
  "head_commit": "4f2c9a1e7b3d5f60a8c2e1d9b7f4a3c2e1d0b9a8",
  "issue": 184,
  "policy_paths_touched": [
    ".gitea/workflows/ci.yml"
  ],
  "pr": 211,
  "reasons": [
    "Touches protected policy path .gitea/workflows/ci.yml; agents may not self-authorise policy changes."
  ],
  "required_approvals": 1,
  "risk_class": "medium",
  "schema_version": 1
}
